[
  {
    "id": "sess-2026-016",
    "title": "UN Tech Over",
    "year": 2026,
    "date": "2026-06-22",
    "day": "Monday, 22 June 2026",
    "track": "Official agenda",
    "kind": "official",
    "organizations": [
      "united-nations-office-for-digital-and-emerging-technologies-odet-united-nations-office-of-information-and-communications-technology-oict"
    ],
    "topics": [
      "sustainability",
      "education"
    ],
    "speakers": [],
    "projects": [],
    "references": [],
    "provenance": {
      "source_url": "https://www.unopensource.org/agenda",
      "source_title": "UN Open Source Week 2026 — official agenda",
      "license": "public-domain",
      "method": "automated-ingestion",
      "retrieved": "2026-06-29",
      "locator": "evt-2026-016"
    },
    "start_time": "09:00",
    "end_time": "17:30",
    "timezone": "America/New_York",
    "room": "UN Headquarters - ECOSOC Chamber",
    "summary": "The UN Tech Over brings people together to work on real UN challenges and build practical solutions through Hack-A-Thon, Edit-A-Thon, and Maintain-A-Thon activities.",
    "official_url": "https://www.unopensource.org/agenda"
  },
  {
    "id": "sess-2026-001",
    "title": "UN Tech Over Hack-A-Thon, Edit-A-Thon, and Maintain-A-Thon",
    "year": 2026,
    "date": "2026-06-22",
    "day": "Monday, 22 June 2026",
    "track": "Community side events",
    "kind": "side-event",
    "organizations": [
      "digital-public-goods-alliance"
    ],
    "topics": [
      "digital-public-goods",
      "sustainability",
      "education",
      "open-source"
    ],
    "speakers": [],
    "projects": [],
    "references": [],
    "provenance": {
      "source_url": "https://hackmd.io/@dpga/Sk05Nc21Me#UN-Tech-Over-%E2%80%94-Monday%2C-22-June",
      "source_title": "UN Open Source Week 2026 — community side events",
      "license": "public-domain",
      "method": "automated-ingestion",
      "retrieved": "2026-06-29",
      "locator": "evt-2026-001"
    },
    "type": "hackathon",
    "start_time": "10:00",
    "end_time": "18:00",
    "timezone": "America/New_York",
    "summary": "Imported from the DPGA UN Open Source Week schedule. See https://hackmd.io/@dpga/Sk05Nc21Me#UN-Tech-Over-%E2%80%94-Monday%2C-22-June for details.",
    "official_url": "https://hackmd.io/@dpga/Sk05Nc21Me#UN-Tech-Over-%E2%80%94-Monday%2C-22-June"
  },
  {
    "id": "sess-2026-018",
    "title": "UN Tech Over Hack-A-Thon",
    "year": 2026,
    "date": "2026-06-22",
    "day": "Monday, 22 June 2026",
    "track": "Official agenda",
    "kind": "official",
    "organizations": [
      "un-open-source-week"
    ],
    "topics": [
      "ai",
      "community",
      "open-source"
    ],
    "speakers": [],
    "projects": [],
    "references": [],
    "provenance": {
      "source_url": "https://www.unopensource.org/agenda",
      "source_title": "UN Open Source Week 2026 — official agenda",
      "license": "public-domain",
      "method": "automated-ingestion",
      "retrieved": "2026-06-29",
      "locator": "evt-2026-018"
    },
    "type": "hackathon",
    "start_time": "10:00",
    "end_time": "18:00",
    "timezone": "America/New_York",
    "room": "ECOSOC Chamber",
    "summary": "This Hack-A-Thon will offer a space for a collaborative innovation sprint where participants use open source tools and artificial intelligence to rapidly build solutions addressing global challenges aligned with UN goals Challenge 1: Safety, Supervision, and Governance in the Agentic World Safety, Supervision and Governance in the Agentic World will be a challenge developed by AESIA (the Spanish Agency for the Supervision of Artificial Intelligence) and the Spanish Open Source AI Community, led",
    "official_url": "https://www.unopensource.org/agenda"
  },
  {
    "id": "sess-2026-019",
    "title": "Edit-A-Thon",
    "year": 2026,
    "date": "2026-06-22",
    "day": "Monday, 22 June 2026",
    "track": "Official agenda",
    "kind": "official",
    "organizations": [
      "un-open-source-week"
    ],
    "topics": [
      "ai",
      "education",
      "open-source"
    ],
    "speakers": [],
    "projects": [],
    "references": [],
    "provenance": {
      "source_url": "https://www.unopensource.org/agenda",
      "source_title": "UN Open Source Week 2026 — official agenda",
      "license": "public-domain",
      "method": "automated-ingestion",
      "retrieved": "2026-06-29",
      "locator": "evt-2026-019"
    },
    "type": "edit-a-thon",
    "start_time": "10:00",
    "end_time": "18:00",
    "timezone": "America/New_York",
    "room": "ECOSOC Chamber",
    "summary": "This event aims to leverage participants’ research, documentation and critical thinking abilities to enhance selected Wikipedia pages of relevance. Throughout the day, experts and mentors will assist participants in updating these pages so as to publish in-depth, accurate reports",
    "official_url": "https://www.unopensource.org/agenda"
  },
  {
    "id": "sess-2026-020",
    "title": "Maintain-A-Thon",
    "year": 2026,
    "date": "2026-06-22",
    "day": "Monday, 22 June 2026",
    "track": "Official agenda",
    "kind": "official",
    "organizations": [
      "un-open-source-week"
    ],
    "topics": [
      "sustainability",
      "government",
      "community",
      "open-source"
    ],
    "speakers": [],
    "projects": [],
    "references": [],
    "provenance": {
      "source_url": "https://www.unopensource.org/agenda",
      "source_title": "UN Open Source Week 2026 — official agenda",
      "license": "public-domain",
      "method": "automated-ingestion",
      "retrieved": "2026-06-29",
      "locator": "evt-2026-020"
    },
    "type": "maintain-a-thon",
    "start_time": "10:00",
    "end_time": "18:00",
    "timezone": "America/New_York",
    "room": "ECOSOC Chamber",
    "summary": "This event, organized for open source maintainers, stewards, and policymakers, spotlights the maintenance of critical open source infrastructure. It consists of two tracks: one featuring open source maintainer-led sessions that share knowledge and best practices and surface the craft of open source software maintenance through real-world examples; and another dedicated to institutional capacity building and long-term stewardship",
    "official_url": "https://www.unopensource.org/agenda"
  },
  {
    "id": "sess-2026-013",
    "title": "Octane Side Event: Sustainable Open Source Funding Infrastructure",
    "year": 2026,
    "date": "2026-06-22",
    "day": "Monday, 22 June 2026",
    "track": "Community side events",
    "kind": "side-event",
    "organizations": [
      "digital-public-goods-alliance"
    ],
    "topics": [
      "digital-public-goods",
      "sustainability",
      "funding",
      "open-source"
    ],
    "speakers": [],
    "projects": [],
    "references": [],
    "provenance": {
      "source_url": "https://hackmd.io/@dpga/Sk05Nc21Me#UN-Tech-Over-%E2%80%94-Monday%2C-22-June",
      "source_title": "UN Open Source Week 2026 — community side events",
      "license": "public-domain",
      "method": "automated-ingestion",
      "retrieved": "2026-06-29",
      "locator": "evt-2026-013"
    },
    "type": "side-event",
    "start_time": "12:00",
    "end_time": "17:00",
    "timezone": "America/New_York",
    "summary": "Imported from the DPGA UN Open Source Week schedule. See https://hackmd.io/@dpga/Sk05Nc21Me#UN-Tech-Over-%E2%80%94-Monday%2C-22-June for details.",
    "official_url": "https://hackmd.io/@dpga/Sk05Nc21Me#UN-Tech-Over-%E2%80%94-Monday%2C-22-June"
  },
  {
    "id": "sess-2026-101",
    "title": "Octane Side Event: Sustainable Open Source Funding Infrastructure (RSVP + Details). Location: Michael J Fox Foundation Offices, 111 W34th St",
    "year": 2026,
    "date": "2026-06-22",
    "day": "Monday, 22 June 2026",
    "track": "Community side events",
    "kind": "side-event",
    "organizations": [
      "digital-public-goods-alliance"
    ],
    "topics": [
      "digital-public-goods",
      "sustainability",
      "funding",
      "open-source"
    ],
    "speakers": [],
    "projects": [],
    "references": [],
    "provenance": {
      "source_url": "https://hackmd.io/@dpga/Sk05Nc21Me#UN-Tech-Over-%E2%80%94-Monday%2C-22-June",
      "source_title": "UN Open Source Week 2026 — community side events",
      "license": "public-domain",
      "method": "automated-ingestion",
      "retrieved": "2026-06-29",
      "locator": "evt-2026-101"
    },
    "type": "side-event",
    "start_time": "12:00",
    "end_time": "17:00",
    "timezone": "America/New_York",
    "summary": "Imported from the DPGA UN Open Source Week schedule. See https://hackmd.io/@dpga/Sk05Nc21Me#UN-Tech-Over-%E2%80%94-Monday%2C-22-June for details.",
    "official_url": "https://hackmd.io/@dpga/Sk05Nc21Me#UN-Tech-Over-%E2%80%94-Monday%2C-22-June"
  },
  {
    "id": "sess-2026-059",
    "title": "Check-In",
    "year": 2026,
    "date": "2026-06-22",
    "day": "Monday, 22 June 2026",
    "track": "Official agenda",
    "kind": "official",
    "organizations": [
      "un-open-source-week"
    ],
    "topics": [
      "open-source"
    ],
    "speakers": [],
    "projects": [],
    "references": [],
    "provenance": {
      "source_url": "https://www.unopensource.org/agenda",
      "source_title": "UN Open Source Week 2026 — official agenda",
      "license": "public-domain",
      "method": "automated-ingestion",
      "retrieved": "2026-06-29",
      "locator": "evt-2026-059"
    },
    "start_time": "16:00",
    "end_time": "16:45",
    "timezone": "America/New_York",
    "summary": "Imported from https://www.unopensource.org/agenda. See the original page for full details.",
    "official_url": "https://www.unopensource.org/agenda"
  },
  {
    "id": "sess-2026-022",
    "title": "Welcome and Opening Remarks",
    "year": 2026,
    "date": "2026-06-22",
    "day": "Monday, 22 June 2026",
    "track": "Official agenda",
    "kind": "official",